Nr projektu;Lokalizacja projektu;Nazwa osiedla;Kategoria projektu;Suma kosztów;Wszystkie opinie;Nazwa projektu
270;D³ugosza 34-68, dzia³ki nr 5 i 9, AM 19;Kar³owice-Ró¿anka;piesze/rowerowe;120000;Tak;Modernizacja chodnika wzd³u¿ ul. D³ugosza pomiêdzy ulicami Boya-¯eleñskiego a Czajkowskiego przy nieruchomoœciach D³ugosza 34 - 68
271;G³ównie teren osiedla So³tysowice (Wroc³aw, Psie Pole), przedmiotowa œcie¿ka mia³aby przebiegaæ ulicami: So³tysowick¹, Poprzeczn¹, Czajkowskiego, Pzybyszewskiego i Koszarow¹.;Kar³owice-Ró¿anka, So³tysowice;piesze/rowerowe;1300000;Nie;Ci¹g pieszo-rowerowy ³¹cz¹cy osiedle So³tysowice z osiedlem Kar³owice oraz skrzy¿owaniem ul. Krzywoustego i ul. 
272;"Droga gruntowa - siêgacz ul. Czekoladowej na wysokoœci nr 64a 
(na mapie ul. Wieletów).
Numery dzia³ek: 514/12, 26/4, 30/1";Klecina;drogowe;94000;Tak;Przebudowa i modernizacja siêgacza ul. Czekoladowej (ul. Wieletów).
273;ul. Mariana Suskiego, Wroc³aw, Oporów, AR_25, 29/16;Oporów;drogowe;67985;Tak;Utwardzenie ulicy Mariana Suskiego
274;dzia³ki: 4/6, 2/15, 2/16;Biskupin-Sêpolno-D¹bie-Bartoszowice;drogowe;83200;Tak;Utwardzenie nawierzchni ³¹cznika drogowego (ul. Smêtna – ul. Monte Cassino)
275;wzd³u¿ ulicy Jarno³towskiej (droga krajowa nr 362) Osiedle Jarno³tów, dzielnica Fabryczna pocz¹wszy od numeru 31 do koñca ulicy Jarno³towskiej;Jerzmanowo - Jarno³tów -Strachowice - Osiniec;piesze/rowerowe;450000;Tak;Wykonanie oraz naprawa chodnika w ci¹gu ulicy Jarno³towskiej
276;Podane poni¿ej na mapie: Wzgórze Andersa ;Huby;inne;100000;Nie;Œciany pod Wroclove Graffiti
277;WROC£AW, WSZYSTKIE DZIA£KI MIEJSKIE;Wroc³aw;inne;112300;Nie;WRAPP'KA - WROC£AWSKI PORTAL INTERWENCJI OBYWATELSKIEJ
278;Ulice z torowiskiem w jezdni;Wroc³aw;inne;1900000;Tak;Przystanki wiedeñskie dla ka¿dego (tramwaju)
279;23/22;Stare Miasto;piesze/rowerowe;100000;Tak;Po³¹czenie rowerowe pl. Solnego z pl. Bohaterów Getta
280;Mo¿liwe lokalizacje: okolice hali stulecia (Zalesie 31 lub 6/4), Wyspa s³odowa (Plac Grunwaldzki 14/2), bulwar Dunikowskiego (Stare Miasto 9/2) ;Wroc³aw;inne;149999;Nie;WROCLOVE - wielkie litery w ciekawym turystycznie punkcie (punktach) miasta, jako miejsce do zrobienia pami¹tkowego zdjêcia we Wroc³awiu. Konkurs na projekt oraz wykonanie liter
281;Aleja Œl¹ska oraz œcie¿ka z ty³u Stadionu Miejskiego biegn¹ca wzd³u¿ rzeki Œlêzy.;Pilczyce-Kozanów-Popowice P³n.;zieleñ/rekreacja;79220;Tak;Monta¿ ³awek oraz koszy na œmieci wokó³ Stadionu Miejskiego we Wroc³awiu
282;Ul. Bia³oskórnicza, ul. Kazimierza Wielkiego;Stare Miasto;drogowe;250000;Nie;"Poprawa dostêpnoœci do przystanku ""Rynek"" i integracja przystanków autobusowych i tramwajowych"
283;ul. Podwale;Przedmieœcie O³awskie;piesze/rowerowe;29000;Tak;Sygnalizacja œwietlna na Podwalu przy skrzy¿owaniu z Komuny Paryskiej
284;"Grabiszyn, AR_43, 4
Grabiszyn, AR_18, 2/52
Grabiszyn, AR_18, 2/34";Gajowice , Borek, granice wroc³awskich osiedli;piesze/rowerowe;486000;Tak;Rowerowo-spacerowe po³¹czenie Gajowic i Borku: rampa na k³adce nad ul. Hallera
285;Papiernicza ( na odcinku za ekranami akustycznymi od ul. Górniczej do ul. Bednarskiej i dalej za parkingiem, do koñca ekranów) = ok. 300 m.b.;Pilczyce-Kozanów-Popowice P³n.;drogowe;30000;Tak;PAS PARKINGOWY.
286;Dzia³ka nr 5/267, AM-3, w obrêbie G¹dów Ma³y (B) ;G¹dów-Popowice P³d. ;zieleñ/rekreacja;147846;Tak;Uporz¹dkowanie zieleñca przy ul. Franciszka Hynka we Wroc³awiu. 
287;AR_12, 32;Kar³owice-Ró¿anka;inne;94200;Tak;RONI-PARK DLA PSÓW
288;Wa³y przeciwpowodziowe miêdzy mostem Kolejowym a Trzebnickim;Kar³owice-Ró¿anka;zieleñ/rekreacja;49400;Tak;Bezpieczne wa³y Kar³owckie
289;"AR_7, 2/9
AR_7, 2/120
AR_7, 2/95";Muchobór Wielki;piesze/rowerowe;116000;Tak;Trakt pieszo-rowerowy na Muchoborze Wielkim ³¹cz¹cy ul. Trawow¹ z rondem rtm. Pileckiego (przy torach)
290;AR_12,33;Kar³owice-Ró¿anka;sport;88200;Tak;REAKTYWACJA BOISKA NA BRODZIKU
291;"ul. Osobowicka i ul. Dembowskiego; Dzia³ki: nr 4 oraz 5/1 obrêb Osobowice oraz Nr 1 obrêb Biskupin";Biskupin-Sêpolno-D¹bie-Bartoszowice, Osobowice - Rêdzin;inne;126000;Tak;Oœwietlenie miejsc niebezpiecznych. Alejka pieszo - rowerowa przy ul. Dembowskiego od ul. Spó³dzielczej do skrzy¿. z ul. Mielczarskiego. Plac zabaw oraz siêgacz przy ul. Osobowickiej nr 146 – 158
292;nr dzia³ki 12;Wojszyce;drogowe;148000;Tak;Remont ulicy Asfaltowej
293;Podwórze wyznaczone przez ulice Sienkiewicza, Sêpa – Szarzyñskiego, Benedyktyñsk¹, Górnickiego;Plac Grunwaldzki;rewitalizacja;82300;Tak;Podwórkowy fitness - si³ownia zewnêtrzna na podwórku
294;ulica Aleksandra Or³owskiego, Wroc³aw/Biskupin;Biskupin-Sêpolno-D¹bie-Bartoszowice;drogowe;650000;Tak;Remont nawierzchni ulicy i chodnika przy ul.Or³owskiego wraz z doprowadzeniem jej do Parku Nadodrzañskiego celem stworzenia arterii komunikacyjnej
295;"ul. Kutrzeby – na odcinku od ul. Opalowej do granicy Miasta
Dzia³ka O³taszyn, AR_14, 2, Typ w³asnoœci: W³asnoœæ Gminy w zarz¹dzie, u¿ytkowaniu
";O³taszyn;piesze/rowerowe;139950;Tak;Budowa chodnika wzd³u¿ ul. Kutrzeby we Wroc³awiu (od ul. Opalowej do granicy Miasta).
296;"Przedszkole Nr 113 ,,Akademia Przedszkolaka"" 54-155 Wroc³aw ul. Lotnicza 22
dzia³ka AM obrêb G¹dów Ma³y 10/9; 10/14; 10/ 15; 10/17";G¹dów-Popowice P³d. ;edukacja;221025;Tak;Osiedlowy teren zajêæ korekcyjno-kompensacyjny dla dzieci, modernizacja ci¹gu komunikacyjnego od ul. Lotniczej 22 oraz wykonanie ekologicznego parkingu 
297;026401-1.0042.AR-14.7/5;G¹dów-Popowice P³d. ;edukacja;152703;Tak;WESO£A GROMADKA PRZYJAZNA WSZYSTKIM  MA£YM OBYWATELOM
298;"AM 14 dz. 2, 4, 
teren pomiêdzy podstaw¹ wa³u przeciwpowodziowego a rzek¹ Odr¹";Szczepin;zieleñ/rekreacja;500000;Tak;Rewitalizacja Odrzañskich miejsc wypoczynku. Uporz¹dkowanie i zagospodarowanie nadodrzañskich terenów rekreacyjnych w obrêbie osiedla Szczepin.
299; Boya-¯eleñskiego od Berenta do Orkana - chodniki, trawniki i miejsca postojowe;Kar³owice-Ró¿anka;piesze/rowerowe;60000;Tak;Chodnik na Boya-¯eleñskiego od Berenta do Orkana
300;Strachowice, AR_7,7/4;Jerzmanowo - Jarno³tów -Strachowice - Osiniec;place zabaw;500000;Nie;Kolorowa Rdestowa 
301;"Zalesie, AR_1, 1/2 ; 
Kana³owa, 51-613 Wroc³aw, Polska
œcie¿ka pieszo-rowerowa pomiêdzy mostem Swojczyckim a œluz¹ Zacisze
";Zacisze-Zalesie-Szczytniki;zieleñ/rekreacja;2000;Nie;3 £awki na wa³ach 
302;"Zalesie, AR_1, 1/2 ; 
Kana³owa, 51-613 Wroc³aw, Polska
œcie¿ka pieszo-rowerowa pomiêdzy mostem Swojczyckim a œluz¹ Zacisze
";Zacisze-Zalesie-Szczytniki;zieleñ/rekreacja;2000;Tak;£awka na wa³ach od strony Zalesia
303;"TEREN ZESPO£U SZKÓ£ NR 15 WE WROC£AWIU, UL. CHOPINA 9B 
ZALESIE AR_4,2";Zacisze-Zalesie-Szczytniki;edukacja;145000;Tak;AKTYWNIE NA CHOPINA
304;Ulica Nasypowa;Powstañców Œl¹skich;piesze/rowerowe;7000;Tak;Bezpieczeñstwo pieszych i rowerzystów na w³¹czeniu ulicy Nasypowej w Powstañców Œl¹skich
305;Park Juliusza S³owackiego,  Las Osobowicki,   Park Tysi¹clecia, Park Grabiszyñski, Park Zachodni, Park Po³udniowy, Park Szczytnicki;Wroc³aw;zieleñ/rekreacja;94500;Nie;7 grzechów g³ównych - rzeŸby plenerowe do parków Wroc³awskich
306;Stadion Olimpijski, Zalesie, AR_6, 1/2,  Wspó³w³asnoœæ Gminy i innych osób prawnych;Zacisze-Zalesie-Szczytniki;inne;50000;Nie;Odtworzenie dawnego pomnika Zwyciêzcy na Stadionie Olimpijskim
307;Litewska AR 24 dzia³ka 23/17;Psie Pole-Zawidawie;zieleñ/rekreacja;90000;Tak;budowa si³owni zewnêtrznej typu outdoor fitness
308;chodnik na terenie gminy, przy ulicy Œlicznej 25-27;Huby;piesze/rowerowe;860;Tak;Parking rowerowo-skuterowy przy ulicy Œlicznej
309;Ulica Sienkiewicza;Nadodrze, O³bin, granice wroc³awskich osiedli;piesze/rowerowe;72000;Tak;Zabezpieczenie chodnika i zieleni miejskiej na Œródmieœciu - Ulice Sienkiewicza, Dmowskiego, Pomorska
310;"Chodnik przy ulicy Piêknej prowadz¹cy do koœcio³a przy skrzy¿owaniu z ulic¹ Bardzk¹ 
nr 2/9; AM-5 ; Obrêb:Gaj
nr 80/2; AM-29 ; Obrêb: Po³udnie
";Tarnogaj;piesze/rowerowe;64200;Tak;Zwiêkszenie bezpieczeñstwa mieszkañców poprzez remont i oœwietlenie chodnika przy ulicy Piêknej
311;ul. Stalowa,  Grabiszyn, AR_11, 8/31;Gajowice ;place zabaw;500000;Tak;Plac zabaw dla dzieci m³odszych i starszych.
312;Osobowice, ul.Osobowicka, DW327, AR-22, AR-20;Osobowice - Rêdzin;inne;83000;Tak;Oœwietlenie przy Osobowickiej
313;Ulica Stodolna, miasto Wroc³aw,  obrêb ewidencyjny 0035- Maœlice , dzia³ka geodezyjna nr 47 AM 12, o pow. 0,1582 ha, WR1K/00260947/0 ;Maœlice;drogowe;420000;Tak;Modernizacja ulicy Stodolnej - budowa ci¹gu pieszo - jezdnego 
314;skrzy¿owanie Kosmonautów z Starogajow¹ i ulic¹ Kamiennogórsk¹;Leœnica;drogowe;700000;Tak;Sygnalizacja œwietlna na skrzy¿owaniu ulicy Kosmonautów z ulic¹ Starogajow¹ i ulic¹ Kamiennogórsk¹
315;ul. Jerzego Kowalskiego, Nazwa obrêbu: Oporów (Wroc³aw), Numer arkusza mapy: 8, Numer dzia³ki: 289;Oporów;drogowe;150000;Tak;Budowa drogi z kostki brukowej betonowej wraz z chodnikiem na odcinku ulicy Kowalskiego we Wroc³awiu
316;AR_2 27/27, AR_2 28/1, AR_2 29;Jagodno;drogowe;96600;Tak;Budowa brakuj¹cego odcinka drogi tymczasowej w ulicy Schuberta na pó³noc od skrzy¿owania z ulic¹ Brahmsa 
317;Promenada Staromiejska, numer dzia³ki Stare Miasto, AR_33, 5/6 ;Stare Miasto;inne;275000;Nie;Pomnik Romana Dmowskiego
318;"Ksiê¿e Ma³e, AR_6, 13;  Ksiê¿e Ma³e, AR_7, 6   (w³asnoœæ Gminy w zarz¹dzie i u¿ytkowaniu) 
Ksiê¿e Ma³e, AR_7, 24/2;  Ksiê¿e Ma³e, AR_7, 25/2  (w³asnoœæ Gminy w zarz¹dzie i u¿ytkowaniu)";Ksiê¿e;zieleñ/rekreacja;40700;Nie;Rewitalizacja otoczenia pêtli tramwajowej na Ksiê¿u Ma³ym
319;Parki: Szczytnicki, na Biskupinie, Skowroni, Andersa, Wschodni, Po³udniowy, Brochowski, Leœnicki, Z³otnicki, Kar³owicki, Zachodni, Popowicki, To³py. Lasy: Osobowicki, przy ul. Lipskiej, So³tysowicki;Wroc³aw;inne;60000;Nie;BUDKI LÊGOWE DLA PTAKÓW we wroc³awskich parkach i lasach.
320;18/3 ul. Krzycka Wroc³aw;Krzyki-Partynice;drogowe;250000;Tak;bezpieczna droga
321;"Numer geodezyjny dzia³ki: 4, 10/42, 10/29, 13 i inne; arkusz mapy AM-3; obrêb Kleczków; M. Wroc³aw";Wroc³aw;inne;185000;Nie;Nowa linia autobusowa przebiegaj¹ca przez osiedle O³bin i Kleczków
322;"Ksiê¿e Ma³e, AR_7, 23;   Ksiê¿e Ma³e, AR_7, 24/2 
Ksiê¿e Ma³e, AR_7, 34
Ksiê¿e Ma³e, AR_7, 29/1;  Ksiê¿e Ma³e, AR   (w³asnoœæ Gminy w zarz¹dzie i u¿ytkowaniu)";Ksiê¿e;inne;102857;Tak;Bezpieczne otoczenie przedszkola na Ksiê¿u Ma³ym
323;ul. Piwna 14 nr dzia³ki 49 i 54/1;Plac Grunwaldzki;edukacja;586000;Tak;Plac zabaw  sportowo-rekreacyjny zlokalizowany na terenie Przedszkola 79
324;Teren po³o¿ony miêdzy ulic¹ Królewieck¹ a lini¹ kolejow¹ relacji Wroc³aw-Wo³ów, pocz¹wszy od rzeki £ugowiny do zabudowañ sklepu Biedronka (obrêb Maœlice, Pilczyce);Maœlice;zieleñ/rekreacja;0;Nie;Kompleksowe zagospodarowanie terenu po³o¿onego wzd³u¿ ulicy Królewieckiej - PARK MAŒLICKI
325;Teren po³o¿ony miêdzy ulic¹ Królewieck¹, a zabudowaniami ulicy Noteckiej i lini¹ kolejow¹ relacji Wroc³aw-Wo³ów, pocz¹wszy od obwodnicy autostradowej Wroc³awia do zabudowañ sklepu Biedronka (obrêb Maœlice, Pilczyce);Maœlice;zieleñ/rekreacja;0;Nie;Kompleksowe zagospodarowanie terenu po³o¿onego wzd³u¿ ulicy Królewieckiej - PARK MAŒLICKI
326;Przedszkole Nr 141, ul. Aleja Genera³a Józefa Hallera 77A, dzia³ka Nr 51/12, AM 18, obrêb 28 - Grabiszyn;Gajowice ;edukacja;50000;Tak;Modernizacja tarasu edukacyjnego Przedszkola Nr 141 
327;Ul. Przewioœnie AM-19, dzia³ka 9/2, ulica;Paw³owice;zieleñ/rekreacja;460000;Nie;Budowa parku rekreacyjno-sportowego na ulicy Przedwioœnie
328;Dzia³ka geodezyjna 24, AM-5, obrêb Ksiê¿e Ma³e.;Ksiê¿e;edukacja;640000;Tak;Budowa boiska przy Szkole Podstawowej nr 99 we Wroc³awiu
329;"AR_12,5/14
AR_11,106
AR_12,75";Kar³owice-Ró¿anka;drogowe;1210000;Tak;Sygnalizacja œwietlna na skrzy¿owaniu ulic Obornickiej i Bezpiecznej
330;"Przedszkole Nr 91 ""Nasz Domek"",  ul. Zaporoska 52A, 53-416 Wroc³aw, 
dzia³ka Nr 2, AM 35, obrêb 22 - Po³udnie";Powstañców Œl¹skich;edukacja;100000;Tak;OGRODZENIE WYDARZENIE - dla Przedszkola 91, sasiadów i nie tylko !
331;S³up elektryczny przy ul. Kowalska 90;Kowale;drogowe;18000;Tak;RADAR na ul. Kowalskiej
332;ul. Wieczysta 105, 50-550 Wroc³aw, numer geodezyjny dzia³ki: Gaj, AR_1, 5/25, Gaj, AR_1, 5/42 i Gaj, AR_1, 1/8;Huby;edukacja;236218;Tak;Renowacja i dostosowanie boiska do pi³ki koszykowej oraz badmintona na terenie ZS-P nr 17
333;Plac Grunwaldzki AR_6,18;O³bin;edukacja;49124;Tak;Bezpieczne ogrodzenie placu zabaw
334;"Dzia³ki w rejonie ul. Kukuczki i Uznañskiego: Gaj, AR_14, 73/3; Gaj, AR_14, 68; Gaj, AR_14, 69; ";Gaj;sport;480000;Nie;KUKUCZKI SPORTLOVE - Boisko wielofunkcyjne ze sztuczn¹ nawierzchni¹ 25 x 45 m przy ul. Kukuczki
335;Nowy Dwór, AR_9, 21/17;Nowy Dwór , Muchobór Ma³y;piesze/rowerowe;495000;Nie;Wypo¿yczalnia Rowerów Miejskich na osiedlu  Nowy Dwór + Muchobór Ma³y 
336;Sêpolno, AR_3, 99/25;Biskupin-Sêpolno-D¹bie-Bartoszowice;piesze/rowerowe;491000;Nie;Rower Miejski dla AWF-u i i Wielkiej Wyspy
337;"Park im. Œw. Edyty Stein przy rogu ul. Nowowiejskiej i Kardyna³a Stefana Wyszyñskiego 
AR_14,81";O³bin;zieleñ/rekreacja;20490;Nie;Piêkny zak¹tek dla turystów i mieszkañców
338;Gaj, AR_10, 21/1;Huby, Gaj;piesze/rowerowe;494000;Nie;Rower Miejski dla Gaju i Hub 
339;Teren znajduj¹cy siê na Krzykach, na osiedlu Huby, przy ul. Œlicznej (w pobli¿u al. Armii Krajowej), na dzia³kach 5/31 i 5/35 AM-1 obrêb Gaj we Wroc³awiu o ³¹cznej powierzchni ok. 6850 m2.;Huby;zieleñ/rekreacja;1247046;Nie;ŒLICZNA - oaza rekreacji na Krzykach
340;Park Popowicki nr dzia³ki 3/5 ;Pilczyce-Kozanów-Popowice P³n.;place zabaw;131749;Tak;WSPINAJ SIÊ PO ZDROWIE - linowy plac zabaw w Parku Popowickim
341;Po³udnie, Ar_10, 15/1;Przedmieœcie O³awskie;zieleñ/rekreacja;50815;Tak;Si³ownia pod chmurk¹. Wiêckowskiego - Koœciuszki - Œwistackiego (Przedmieœcie O³awskie)
342;Paw³owicka AR_9 Nr dzia³ki 52/1;Paw³owice;drogowe;15000;Tak;Utwardzenie drogi gminnej 
343;Paw³owicka AR_9 Nr dzia³ki 52/1;Paw³owice;inne;135000;Tak;BRAK WODY WE WROC£AWIU - Sieæ wodoci¹gowa przy ulicy Paw³owickiej we Wroc³awiu
344;Paw³owicka AR_9 Nr dzia³ki 52/1;Paw³owice;inne;145000;Tak;Oœwietlenie drogi gminnej Paw³owickiej na Paw³owicach
345;"Szko³a Podstawowa Nr 78 im. Miko³aja Kopernika we Wroc³awiu ul. Jednoœci Narodowej 195 , 50-303 Wroc³aw;
Plac Grunwaldzki, AR_10, 69";O³bin;edukacja;89443;Tak;Oœwietlenie boiska Szko³y Podstawowej Nr 78 we Wroc³awiu
346;STARE MIASTO AR_27, 23/2;Stare Miasto;edukacja;98000;Tak;Rewitalizacja terenu sportowego Gimnazjum nr 29
347;Wroc³aw ul. Mi³oszycka oraz Kowalska;Strachocin-Swojczyce-Wojnów, Kowale;piesze/rowerowe;2000000;Tak;Budowa œcie¿ki rowerowej oraz chodnika wzd³u¿ ulic Mi³oszyckiej i Kowalskiej
348;dz. nr. 39, 40, 41/1, AM-29, obrêb Po³udnie.;Tarnogaj;drogowe;149736;Tak;,,Budowa ogólnodostêpnej drogi wewnêtrznej wraz z odcinkiem kanalizacji deszczowej”
349;Ul Chodkiewicza dzia³ka 15 AM-3 obrêb Jerzmanowo;Jerzmanowo - Jarno³tów -Strachowice - Osiniec;drogowe;50000;Tak;U³o¿enie nawierzchni asfaltowej
350;"POMIÊDZY UL. PRUSA, UL. BEMA, UL.ŒWIÊTOKRZYSKA
OBRÊB PL.GRUNWALDZKI, AM-16, DZ.NR 2";O³bin;zieleñ/rekreacja;2000000;Tak;SKWER SKACZ¥CEJ GWIAZDY 
351;"Maœlice, AR_6; Typ w³asnoœci: w³asnoœæ Gminy w zarz¹dzie, u¿ytkowaniu; Nazwa obrêbu: Maœlice; Numer arkusza mapy: 6; Numer dzia³ki: 93 i 96; Ulice: Siedlecka i Bia³ostocka
";Maœlice;inne;91000;Tak;Oœwietlenie ulic Siedleckiej i czêœci ulicy Bia³ostockiej
352;Skrzy¿owanie ul. Siedlecka / Bia³ostocka, obrêb Maœlice, AR_6, dzia³ka 97;Maœlice;place zabaw;148500;Nie;Budowa placu zabaw na Maœlicach - ul. Siedlecka i Bia³ostocka
353;wyspa pomiêdzy rzek¹ Widaw¹ a M³ynówk¹, dzia³ka nr 13,AM 1 , obrêb Widawa;Widawa;zieleñ/rekreacja;150000;Nie;"Uporz¹dkowanie terenu zielonego ""Park Widawski"""
354;"teren przy Szkole Podstawowej nr 30 ul. Zaporoska 28 53-523 Wroc³aw; / Po³udnie, AR_22, 1/2 ";Powstañców Œl¹skich;edukacja;495752;Tak;EUROPEJSKA STREFA ZABAWY / przebudowa terenu przy Szkole Podstawowej nr 30, przy ul. Zaporoskiej 28 we Wroc³awiu 
355;Adres: ul. Reja 36 - 40, numer geodezyjny: Obrêb Plac Grunwaldzki AR_15 , 85/2;O³bin;rewitalizacja;87000;Tak;#PodworkoNaReja - poprawa stanu zieleni, nawierzchni i wykonanie odwodnienia
356;"SKRZY¯OWANIE ULIC GEN. KAZIMIERZA PU£ASKIEGO I TADEUSZA KOŒCIUSZKI
OBRÊB .PO£UDNIE, AM-8, DZ.NR 90/8, 71, czêœæ 64/15, czêœæ 64/16
AM- 9, DZ.NR 65/71, 70
";Przedmieœcie O³awskie;zieleñ/rekreacja;2000000;Nie;PLAC AMERYKAÑSKI
357;"Obrêb G¹dów Ma³y Dzia³ka nr. 5/273
 ok. 0,8 ha przedmiotowej dzia³ki przeznaczona w MPZP pod tereny zieleni";G¹dów-Popowice P³d. ;zieleñ/rekreacja;100000;Nie;Zagospodarowanie przestrzeni miêdzy blokowej. Stworzenie parku dla mieszkañców Osiedla Kosmonautów, pomiêdzy ulicami Drzewieckiego , Bajana i bulwaru Dedala
358;"PL. LEGIONÓW/PI£SUDSKIEGO/KOŒCIUSZKI
OBRÊB STARE MIASTO, AM-32, DZ. 29/1, 30/1";Przedmieœcie Œwidnickie;zieleñ/rekreacja;1800000;Nie;SKWER LEGIONÓW
359;"ALEJA ARMII KRAJOWEJ / SPISKA - CZÊŒÆ PARKU SKOWRONIEGO
OBRÊB PO£UDNIE, AM-38, DZ.NR 30,29, AM-39, DZ.NR 1/3, 10
";Gaj, Huby, granice wroc³awskich osiedli;zieleñ/rekreacja;2000000;Nie;BRAMA SPISKA
360;"teren przy Szkole Podstawowej nr 30 ul. Zaporoska 28 53-523 Wroc³aw; / Po³udnie, AR_22, 1/2 ";Powstañców Œl¹skich;edukacja;127044;Tak;BOISKO DO SIATKÓWKI  / budowa boiska do gier przy Szkole Podstawowej nr 30, ul. Zaporoska 28 we Wroc³awiu
361;"UL. PRUSA/ UL. NOWOWIEJSKA
OBRÊB PL.GRUNWALDZKI, AM-8, DZ.NR 31,32,33
";O³bin;zieleñ/rekreacja;2000000;Nie;SKWER LUDZI ZE ZNAKIEM P
362;Nr  dzia³ki 23/2 arkusz mapy 27;Stare Miasto;edukacja;468000;Tak;Budowa Boiska sportowego sztuczn¹ nawierzchni¹ przy ul. Kraiñskiego 
363;"obrêb Zakrzów;  Arkusz 19 nry dzia³ek	13/1, 16/12, 8/3, 9/4, 10/4, 11/3, 11/4, 12/3, 13/9, 13/13, 13/6; Arkusz 15 nr dzia³ki 3/11";Psie Pole-Zawidawie;piesze/rowerowe;1910000;Tak;Œcie¿ka pieszo-rowerowa wzd³u¿ al. Jana III Sobieskiego od ul. Wilanowskiej do ul. Odolanowskiej (Mirków)
364;Biskupin, AR_9,10 w³asnoœæ gminy Wroc³aw w trwa³ym zarz¹dzie Gimnazjum nr 20;Biskupin-Sêpolno-D¹bie-Bartoszowice;edukacja;1220000;Tak;Rekreacyjno - sportowy kompleks Biskupin - Sêpolno. Bie¿nia lekkoatletyczna, boisko do p. no¿nej, si³ownia zewnêtrzna. Ulica Pautscha.
365;ul. Koszarowa 3, droga na dzia³ce AR_16,3 ;Kar³owice-Ró¿anka;piesze/rowerowe;8700;Tak;Chodniki dla pieszych na Koszarowej. Ustawienie s³upków uniemo¿liwiaj¹cych parkowanie na chodniku w s¹siedztwie szpitala i uniwersytetu na ul. Koszarowej
366;Ar 16, 135 W³asnoœæ Gminy w zarz¹dzie;Maœlice;piesze/rowerowe;100000;Nie;Œcie¿ka gruntowa utwardzana wzd³u¿ £ugowiny miêdzy ul. Ostródzk¹ i Brodnick¹
367;AR_8, 6/3;Szczepin;piesze/rowerowe;38000;Tak;Bezpieczne przedszkolaki na Inowroc³awskiej
368;Stare Miasto, AR_23, 4/57;Przedmieœcie Œwidnickie;place zabaw;150000;Tak;Têczowy plac zabaw
369;ul. £owiecka 6. Dzia³ka : Plac Grunwaldzki, AR_20, 6/1;Nadodrze;inne;150000;Nie;Badania geotermalne - odwierty 
370;Wyspa S³odowa 7, Dzia³ka: Plac Grunwaldzki, AR_26, 11/1;Stare Miasto;zieleñ/rekreacja;150000;Nie;Wisz¹ce ogrody na kamienicy na Wyspie S³odowej, wraz z termoizolacj¹ i graj¹cymi na wietrze rzeŸbami
371;Wyspa S³odowa 7, Dzia³ka: Plac Grunwaldzki, AR_26, 11/1;Stare Miasto;sport;50000;Nie;Budowa boiska do boule/buli/pentaqu na Wyspie S³odowej przy kamienicy tam po³o¿onej
372;Park Grabiszyñski;Grabiszyn-Grabiszynek;inne;150000;Nie;Park Muzyki - 15 rzeŸb i instalacji graj¹cych muzykê na wietrze
373;K¹pielisko Oporowskie, Dzia³ka: Oporów, AR_3, 49;Oporów;zieleñ/rekreacja;2000000;Tak;Rewitalizacja Oporowskiego Otwartego Basenu
374;Obrêb Polanowice, nr arkusza mapy 9 , nr. dz. 29;Polanowice - Poœwiêtne - Ligota;drogowe;45000;Tak;Rondo Polanowickie
375;Wnêtrze podwórkowe przy skrzy¿owaniu ulic Kruczej i Mieleckiej, numer dzia³ki: Grabiszyn, AR_18, 41/41;Gajowice ;place zabaw;117100;Tak;Miejsce do zabawy dla dzieci - ul. Krucza/Mielecka
376;Dzia³ka przy Szkole Podstawowej nr 98. ul. Sycowska 22A. Teren przed g³ównym wejœciem do Szko³y i przed wejœciem do Miejskiej Biblioteki Publicznej . Teren Urzêdu Miasta.;Psie Pole-Zawidawie;edukacja;130000;Tak;Odpoczynek i rekreacja przy stolikach szachowych, gry integracyjne.
377;Obrêb Strachowice, AR 1, dzia³ka nr 18;Jerzmanowo - Jarno³tów -Strachowice - Osiniec;sport;114005;Nie;Renowacja nawierzchni boisk do koszykówki i siatkówki i budowa nawierzchni  polipropylenowej.
378;Alejka spacerowa po³o¿ona poœrodku ul. Wandy (Osiedle Powstañców Œl¹skich);Powstañców Œl¹skich;piesze/rowerowe;114800;Nie;Rewitalizacja alejki spacerowej na ul. Wandy
379;ul. Polanowicka, dz. nr. 10;Polanowice - Poœwiêtne - Ligota;inne;47150;Nie;Rekonstrukcja kraty fortecznej Fortu Piechoty nr 6
380;Paw³owice, ulice Malwowa, Przedwioœnie,  Starodêbowa, Paw³owicka, ;Paw³owice;drogowe;25000;Tak;Progi zwalniaj¹ce na Paw³owicach w okolicach szko³y 
381;Wroc³aw O³taszyn skrzy¿owanie ul. Kurpiów, Grota Roweckiego i Wspólnej.;O³taszyn;drogowe;350000;Tak;Poprawa bezpieczeñstwa ruchu na skrzy¿owaniu ul. Kurpiów, Grota Roweckiego i Wspólnej na O³taszynie poprzez wykonanie  oznakowania pionowego, progów spowalniaj¹cych i fotoradaru.
382;ulica Wojanowska, obrêb Stab³owice, AM-17, dzia³ki: 56/4, 56/5, 58/11 i 58/12;Leœnica;zieleñ/rekreacja;761500;Nie;Promenada Stab³owicka – lokalne miejsce spotkañ przy ulicy Wojanowskiej
383;Nadodrze;Nadodrze;piesze/rowerowe;500000;Tak;Remont chodników na Nadodrzu
384;Aleja Ludomira Ró¿yckiego 1a 51-608 Wroc³aw nr geodezyjny dzia³ki AM 13 nr 22 obrêb Zalesie;Zacisze-Zalesie-Szczytniki;edukacja;245864;Tak;"Modernizacja ogrodzenia wokó³ Przedszkola nr 47 ""Leœny Ludek"""
385;Plac Legionów – Dworzec G³ówny – ul. Pu³askiego – ul. Swobodna;Przedmieœcie Œwidnickie;piesze/rowerowe;62500;Tak;Bezpiecznie na rowerze: Plac Legionów – Dworzec G³ówny – ul. Pu³askiego – ul. Swobodna
386;ul. Wêdkarzy 1a, AR_27, 23/6 Rêdzin;Osobowice - Rêdzin;zieleñ/rekreacja;250000;Nie;Budowa placu zabaw i boiska sportowego na osiedlu Rêdzin
387;ul. Agrestowa;Krzyki-Partynice;drogowe;340000;Tak;Wymiana nawierzchni na ulicy Agrestowej
388;ul. Obornicka (od Bezpiecznej do Ba³tyckiej);Kar³owice-Ró¿anka;drogowe;100000;Tak;Uspokojenie ruchu na ul. Obornickiej
389;ul. Szmaragdowa, ul. Nefrytowa;O³taszyn;drogowe;60000;Tak;Progi spowalniaj¹ce na ul. Szmaragdowej i ul. Nefrytowej
390;Borek, AR_6, 14;Borek;drogowe;36000;Nie;Progi zwalniaj¹ce na ulicy Orlej, Krzyki, Borek
391;Borek, AR_6, 14;Borek;drogowe;36000;Tak;Progi zwalniaj¹ce na ulicy Orlej, Krzyki, Borek
392;PODWÓRKO U ZBIEGU UL.NYSKIEJ, JESIONOWEJ I PACZKOWSKIEJ.;Tarnogaj;drogowe;180000;Tak;NAPRAWA DROGI WEWNÊTRZNEJ OSIEDLOWEJ
393;Ga³owska 12;Jerzmanowo - Jarno³tów -Strachowice - Osiniec;sport;1999100;Nie;"""Zachodni Oœrodek Sportu"" Budowa kompleksu dwóch boisk do pi³ki no¿nej oraz budynku z zapleczem sanitarno-szatniowym na osiedlu Jerzmanowo."
394;Skrzy¿owanie ulic Rac³awickiej, Gajowickiej i Orlej;Borek;drogowe;15000;Tak;Bezpieczna droga dla przedszkolaka
395;Ratyñ, AR_7, 51/2;Leœnica;place zabaw;150000;Nie;Weso³e Pustki
396;"Ratyñ, AR_4, 95/1
Ratyñ, AR_7, 51/2";Leœnica;zieleñ/rekreacja;800000;Nie;Boisko i plac zabaw na osiedlu Pustki
397;Ul. Orla 5/7, dzia³ka nr 64, AM 6, obrêb Borek ;Borek;edukacja;495000;Nie;"""Ogród z Fantazj¹"" -nowy plac zabaw przy Przedszkolu nr 28 Fantazja "
398;Ul.Osiniecka Wroc³aw AM 32 dz.nr 7/1;¯erniki ;sport;40000;Tak;Osiedle na Sportowo
399;Zachodnia czêœc Wroc³awia: Leœnica , Z³otniki, Stab³owice, Marszowice,  ;Leœnica;inne;1500000;Nie;Monitoring wizyjny  zachodniej  czêœci Wroc³awia   /Leœnica, Stab³owice, Z³otniki, Marszowice /  
400;"Ul. Popielskiego i ul. Gliwicka, 52-013 Wroc³aw Ksiê¿e Ma³e/Wielkie
ul. Popielskiego AR_4, 19/2, 
ul. Gliwicka AR_7,23 
ul. Popielskiego/Gliwicka AR_7, 35/3
";Ksiê¿e;drogowe;379000;Tak;"""KSIÊ¯E MA£E - Bezpieczna droga maluchów do Przedszkola „Ma³y Ksi¹¿e” przy ul. Chorzowskiej  – budowa 80 mb ulicy Popielskiego wraz z budow¹ 180 mb chodnika wraz z oœwietleniem"""
401;"al. Na Niskich £akach 8, Stadion O³awka
Po³udnie, Numer arkusza mapy: 12, Numer dzia³ki: 11. Al. Na
Niskich £¹kach 8";Przedmieœcie O³awskie;sport;150000;Tak;Poprawa infrastruktury treningowej dla dyscyplin baseball i softball
402;"Podwórze ograniczone ulicami: Sienkiewicza, Roentgena, Grunwaldzka i Minkowskiego; nr dzia³ki: 82/3, AM 29, obrêb: Plac Grunwaldzki; pow. 0,4025; jedn.rej. G.2590";Plac Grunwaldzki;rewitalizacja;149000;Tak;Projekt zagospodarowania , rewitalizacji i odtworzenia funkcji u¿ytkowych podwórza.
403;Ul. Rac³awicka 62, Dane geodezyjne: Obrêb Borek, Arkusz 6, Dzia³ka nr 3/10;Borek;zieleñ/rekreacja;200000;Tak;Basen na po³udniu – reaktywacja odkrytego k¹pieliska przy ul. Rac³awickiej 62 dla mieszkañców Wroc³awia
404;"AR-2,18; AR-4,10; ";O³taszyn;inne;84000;Tak;Poprawa bezpieczeñstwa w obszarze ul. Motylkowej poprzez budowê oœwietlenia ulicznego
405;"Ksiê¿e Ma³e AM-7 nr 36 Górnoœl¹ska
Ksiê¿e Ma³e AM-7 nr 23 Gliwicka
Ksiê¿e Ma³e AM-7 nr 22 Hajducka
Ksiê¿e Wielkie AM-6 nr 86 Popielskiego siêgacz
Brochów AM-4 nr 19/2 Popielskiego g³ówna";Ksiê¿e;drogowe;1988550;Tak;POPIELANY droga prosta - infrastruktura ulicy Leona Popielskiego i okolic - obrêb Ksiê¿e Wielkie, Ksiê¿e Ma³e i Brochów
